{
 "id": "IF-EXT-GEO-CON-VOLUME-001",
 "name": "Divider set to customer drawer envelope",
 "endpoint_a": "E-PRINT-001",
 "endpoint_b": "E-DRAWER-001",
 "boundary": "EXT",
 "domains": [
  "GEO"
 ],
 "function": "CON",
 "geometry": "VOLUME",
 "lifecycle_states": [
  "assembly",
  "use",
  "service",
  "storage"
 ],
 "coordinate_frame": {
  "origin": "centre of the divider set footprint",
  "x_positive": "drawer width",
  "y_positive": "drawer depth",
  "z_positive": "up from the drawer floor",
  "unit": "mm"
 },
 "datums": [
  {
   "id": "A",
   "description": "outer footprint of the assembled lane block"
  }
 ],
 "degrees_of_freedom": {
  "allowed": [
   "lift the block out of the drawer"
  ],
  "constrained": [
   "block sliding when the drawer is opened"
  ]
 },
 "assembly": {
  "direction": "place into the open drawer",
  "contact_mode": "loose placement, no fixing",
  "sequence_notes": "The drawer is customer-supplied; its envelope is a configurator input, never an assumed value."
 },
 "dimensions": [
  {
   "id": "DIM-DRAWER-001",
   "feature": "customer drawer internal envelope",
   "status": "UNKNOWN",
   "source_ref": "customer configurator input",
   "criticality": "FIT_CRITICAL"
  }
 ],
 "environment_and_variation": {
  "environment": "dry indoor drawer",
  "uncontrolled": [
   "drawer size, corner radii and depth",
   "drawer liner"
  ]
 },
 "keepouts_and_access": [
  "No structural, load-bearing or anti-tip claim.",
  "Never assume a drawer size; it is always an input."
 ],
 "evidence": {
  "level": "E1",
  "sources": [
   "business/02-portfolio/research-ideas-r3-variants.csv#SKU-507"
  ],
  "variant_confirmed": false,
  "coverage_percent": 20.0,
  "uncertainty_note": "The drawer is customer-owned and unknown by design. The product is parametric precisely because this interface cannot be fixed.",
  "observability": "UNKNOWN"
 },
 "interface_complexity": {
  "GEO": 1,
  "KIN": 0,
  "TOL": 1,
  "PHY": 0,
  "VAR": 3,
  "LIF": 1,
  "total": 6,
  "tier": "I1"
 },
 "criticality": "K1",
 "failure_modes": [
  {
   "mode": "The generated block does not fit the entered drawer.",
   "effect": "Unusable print and wasted material.",
   "mitigation": "Validate configurator inputs against the print envelope and emit a dimensional check sheet with every release."
  }
 ],
 "verification": {
  "method": "inspection",
  "acceptance_criteria": [
   "The generated footprint never exceeds the entered drawer envelope minus the declared placement clearance.",
   "The generated block stays inside the 220 x 180 x 80 mm planning envelope or is split into modules."
  ],
  "status": "PLANNED",
  "result_refs": []
 },
 "owner": "design lead",
 "version": "0.1.0"
}
